{
  "aggregate": {
    "allPayloadDigestsUnique": true,
    "baselineNLLNatPerToken": 2.759566843509674,
    "blocks": 32,
    "cacheCosineSimilarity": 0.9999947929951745,
    "cacheMaximumAbsoluteError": 0.40668708086013794,
    "cacheNormalizedRMSE": 0.003227083391936859,
    "candidateNLLNatPerToken": 2.759505908936262,
    "compressionRatioVsBF16": 2.0532909042315346,
    "configuration": {
      "backend": "voidtoken-v5",
      "bitsByLayer": [
        9,
        8,
        8,
        8,
        8,
        8,
        8,
        8,
        9,
        8,
        8,
        8,
        8,
        8,
        8,
        8,
        8,
        8,
        8,
        8,
        8,
        8,
        8,
        8
      ],
      "codeCompression": "zlib-9",
      "groupSize": 128,
      "scaleCompression": "zlib-9",
      "schedule": "group-kl-top-2-9bit-rest-8bit",
      "signMode": "none",
      "transformBlockSize": 128
    },
    "configurationId": "4c7be8c836aa7257",
    "decodeNanoseconds": 13717852089,
    "deltaNLLNatPerToken": -6.093457341194153e-05,
    "denseBF16Bytes": 150601728,
    "encodeNanoseconds": 27637357645,
    "encodedFileBytes": 73346513,
    "gates": {
      "compression": true,
      "deltaNLL": true,
      "top1Agreement": true
    },
    "meanKLDivergenceNat": 0.0001343117472032418,
    "modelContinuationNanoseconds": 10301857835,
    "pass": true,
    "perplexityRatio": 0.9999390672830615,
    "predictionTokens": 4096,
    "top1Agreement": 0.993896484375
  },
  "attemptArtifactSHA256": "7f6bc0867db1e3d633c3ecb68aa968be94c73c818b2a5163793495cfb63c17a0",
  "attemptMarkerSHA256": "5f8e4ea82d6d0419390d66534fb6334e7b14fcecd3003e1203f0dbd972cfde74",
  "baselines": [
    {
      "baselineContinuationNanoseconds": 261931834,
      "blockIndex": 384,
      "canonicalBF16NLLNatPerToken": 3.5928304195404053,
      "canonicalCacheBF16SHA256": "3b7fc6930ec8faa3003038282977920fd371127fa574ef2c71e7f66583a6578d",
      "denseBF16Bytes": 4706304,
      "exactRebuildMaxAbsLogitDifference": 0.0,
      "exactRebuildTop1Identical": true,
      "headDimension": 64,
      "kvHeads": 2,
      "layers": 24,
      "layoutRebuildMaxAbsLogitDifference": 0.0,
      "layoutRebuildTop1Identical": true,
      "nativeBF16DeltaNLLNatPerToken": -0.00030684471130371094,
      "nativeBF16Top1Agreement": 0.984375,
      "originalContinuationNanoseconds": 317333084,
      "originalFP32NLLNatPerToken": 3.593137264251709,
      "originalRebuildContinuationNanoseconds": 269016875,
      "predictionTokens": 128,
      "tokenIdsSHA256": "21f37c5d239c895c79d1a48398b662f4a0cca6eaf8bb511ee370f9f6cbaa91c6",
      "trajectoryShapePerLayer": [
        383,
        256
      ]
    },
    {
      "baselineContinuationNanoseconds": 262359916,
      "blockIndex": 385,
      "canonicalBF16NLLNatPerToken": 3.7055304050445557,
      "canonicalCacheBF16SHA256": "8013b338ae520e678bf24f7fe8c678fdd9df218e5f9d211c414b956ca2d1dbe2",
      "denseBF16Bytes": 4706304,
      "exactRebuildMaxAbsLogitDifference": 0.0,
      "exactRebuildTop1Identical": true,
      "headDimension": 64,
      "kvHeads": 2,
      "layers": 24,
      "layoutRebuildMaxAbsLogitDifference": 0.0,
      "layoutRebuildTop1Identical": true,
      "nativeBF16DeltaNLLNatPerToken": 0.0007870197296142578,
      "nativeBF16Top1Agreement": 1.0,
      "originalContinuationNanoseconds": 265570209,
      "originalFP32NLLNatPerToken": 3.7047433853149414,
      "originalRebuildContinuationNanoseconds": 263742750,
      "predictionTokens": 128,
      "tokenIdsSHA256": "636358aaa22fd12e8b061aa57e277dc95de675cc8a6f2fb44114b19c07890dde",
      "trajectoryShapePerLayer": [
        383,
        256
      ]
    },
    {
      "baselineContinuationNanoseconds": 263881875,
      "blockIndex": 386,
      "canonicalBF16NLLNatPerToken": 2.2199130058288574,
      "canonicalCacheBF16SHA256": "412daa0975153a8ce944516e52047e257c335bb47ea6b38465cc8b48fa4b48bb",
      "denseBF16Bytes": 4706304,
      "exactRebuildMaxAbsLogitDifference": 0.0,
      "exactRebuildTop1Identical": true,
      "headDimension": 64,
      "kvHeads": 2,
      "layers": 24,
      "layoutRebuildMaxAbsLogitDifference": 0.0,
      "layoutRebuildTop1Identical": true,
      "nativeBF16DeltaNLLNatPerToken": 0.0004398822784423828,
      "nativeBF16Top1Agreement": 1.0,
      "originalContinuationNanoseconds": 268080459,
      "originalFP32NLLNatPerToken": 2.219473123550415,
      "originalRebuildContinuationNanoseconds": 265129792,
      "predictionTokens": 128,
      "tokenIdsSHA256": "938338178801a354f1209415eb05b2cd166aeff78adf4f076bf9d6f27620e523",
      "trajectoryShapePerLayer": [
        383,
        256
      ]
    },
    {
      "baselineContinuationNanoseconds": 264669584,
      "blockIndex": 387,
      "canonicalBF16NLLNatPerToken": 2.652958631515503,
      "canonicalCacheBF16SHA256": "06bb15f7d5808f7f4c4d4cb4f2b9e35e1cdc4b7e683a702fa8a349ff87ee6039",
      "denseBF16Bytes": 4706304,
      "exactRebuildMaxAbsLogitDifference": 0.0,
      "exactRebuildTop1Identical": true,
      "headDimension": 64,
      "kvHeads": 2,
      "layers": 24,
      "layoutRebuildMaxAbsLogitDifference": 0.0,
      "layoutRebuildTop1Identical": true,
      "nativeBF16DeltaNLLNatPerToken": -2.4318695068359375e-05,
      "nativeBF16Top1Agreement": 1.0,
      "originalContinuationNanoseconds": 264264459,
      "originalFP32NLLNatPerToken": 2.6529829502105713,
      "originalRebuildContinuationNanoseconds": 262170250,
      "predictionTokens": 128,
      "tokenIdsSHA256": "fb783142a52ce3d7f89f1572e7bd53b9305d01e880773948760e05d2ecabce00",
      "trajectoryShapePerLayer": [
        383,
        256
      ]
    },
    {
      "baselineContinuationNanoseconds": 265203625,
      "blockIndex": 388,
      "canonicalBF16NLLNatPerToken": 2.772775173187256,
      "canonicalCacheBF16SHA256": "4b03164dfa9e034b9763f3eb539291d6dae80e73b684c1bf971ffc2edb35059c",
      "denseBF16Bytes": 4706304,
      "exactRebuildMaxAbsLogitDifference": 0.0,
      "exactRebuildTop1Identical": true,
      "headDimension": 64,
      "kvHeads": 2,
      "layers": 24,
      "layoutRebuildMaxAbsLogitDifference": 0.0,
      "layoutRebuildTop1Identical": true,
      "nativeBF16DeltaNLLNatPerToken": 0.0011115074157714844,
      "nativeBF16Top1Agreement": 1.0,
      "originalContinuationNanoseconds": 266130125,
      "originalFP32NLLNatPerToken": 2.7716636657714844,
      "originalRebuildContinuationNanoseconds": 256091833,
      "predictionTokens": 128,
      "tokenIdsSHA256": "a451ab4142b43cf6c8e274ee5598a763c6149dead721531d1f03da3c4baffcd1",
      "trajectoryShapePerLayer": [
        383,
        256
      ]
    },
    {
      "baselineContinuationNanoseconds": 292131459,
      "blockIndex": 389,
      "canonicalBF16NLLNatPerToken": 3.832298517227173,
      "canonicalCacheBF16SHA256": "2fe4dbef540ce0b25a9b972d5fbef4dbbb61ce8ba6da53a6f75924e7504fe915",
      "denseBF16Bytes": 4706304,
      "exactRebuildMaxAbsLogitDifference": 0.0,
      "exactRebuildTop1Identical": true,
      "headDimension": 64,
      "kvHeads": 2,
      "layers": 24,
      "layoutRebuildMaxAbsLogitDifference": 0.0,
      "layoutRebuildTop1Identical": true,
      "nativeBF16DeltaNLLNatPerToken": 0.0009436607360839844,
      "nativeBF16Top1Agreement": 0.9921875,
      "originalContinuationNanoseconds": 269294208,
      "originalFP32NLLNatPerToken": 3.831354856491089,
      "originalRebuildContinuationNanoseconds": 265842833,
      "predictionTokens": 128,
      "tokenIdsSHA256": "afc5c27dc9b5e00790685edf2d9a110cc60a27db17dae91780da180b35a70a82",
      "trajectoryShapePerLayer": [
        383,
        256
      ]
    },
    {
      "baselineContinuationNanoseconds": 263503750,
      "blockIndex": 390,
      "canonicalBF16NLLNatPerToken": 3.379807949066162,
      "canonicalCacheBF16SHA256": "94ae22bcd2f9200304f7041bcae1fdadb212418fa458f068fac12a46b8fb10c3",
      "denseBF16Bytes": 4706304,
      "exactRebuildMaxAbsLogitDifference": 0.0,
      "exactRebuildTop1Identical": true,
      "headDimension": 64,
      "kvHeads": 2,
      "layers": 24,
      "layoutRebuildMaxAbsLogitDifference": 0.0,
      "layoutRebuildTop1Identical": true,
      "nativeBF16DeltaNLLNatPerToken": -0.00030684471130371094,
      "nativeBF16Top1Agreement": 1.0,
      "originalContinuationNanoseconds": 255480292,
      "originalFP32NLLNatPerToken": 3.380114793777466,
      "originalRebuildContinuationNanoseconds": 265056792,
      "predictionTokens": 128,
      "tokenIdsSHA256": "4ec9609c534959280776d0ee40da5d9553364d321bb89f6ac33c1929260e040d",
      "trajectoryShapePerLayer": [
        383,
        256
      ]
    },
    {
      "baselineContinuationNanoseconds": 265946625,
      "blockIndex": 391,
      "canonicalBF16NLLNatPerToken": 2.358884811401367,
      "canonicalCacheBF16SHA256": "53a3e868716a66be7fdd783385705545229442ff3eed94ed5f68d26f813a9cff",
      "denseBF16Bytes": 4706304,
      "exactRebuildMaxAbsLogitDifference": 0.0,
      "exactRebuildTop1Identical": true,
      "headDimension": 64,
      "kvHeads": 2,
      "layers": 24,
      "layoutRebuildMaxAbsLogitDifference": 0.0,
      "layoutRebuildTop1Identical": true,
      "nativeBF16DeltaNLLNatPerToken": 0.0004932880401611328,
      "nativeBF16Top1Agreement": 1.0,
      "originalContinuationNanoseconds": 263725083,
      "originalFP32NLLNatPerToken": 2.358391523361206,
      "originalRebuildContinuationNanoseconds": 264297875,
      "predictionTokens": 128,
      "tokenIdsSHA256": "dd12b00146bac1891719c0472d204425cd874492a588ce04b3acf96d5803d350",
      "trajectoryShapePerLayer": [
        383,
        256
      ]
    },
    {
      "baselineContinuationNanoseconds": 267498917,
      "blockIndex": 392,
      "canonicalBF16NLLNatPerToken": 1.9772119522094727,
      "canonicalCacheBF16SHA256": "d2d8b9211171471205e0df4663461267107fd5be434d6ecce72456c06b6a26f4",
      "denseBF16Bytes": 4706304,
      "exactRebuildMaxAbsLogitDifference": 0.0,
      "exactRebuildTop1Identical": true,